{
  "formatVersion": 1,
  "id": "developer.scatter-emitter",
  "name": "Scatter Emitter",
  "description": "A wide-mouthed emitter that throws a fan of pulses. Ruinous at close quarters, weak at range.",
  "license": "CC0-1.0",
  "type": "tool",
  "action": "disable-pulse",
  "charges": 8,
  "researchCost": 90,
  "effect": {
    "attack": 6,
    "range": 6.0,
    "cooldown": 1.1,
    "pellets": 5,
    "spread": 36,
    "damageType": "bullet"
  },
  "price": 70,
  "weight": 6,
  "icon": "scatter",
  "carry": "rifle",
  "sound": "scatter"
}
