{
  "formatVersion": 1,
  "id": "developer.civic-pulse-emitter",
  "name": "Civic Pulse Emitter",
  "description": "A short-range directed tool for safely disabling automated watchers.",
  "license": "CC0-1.0",
  "type": "tool",
  "action": "disable-pulse",
  "charges": null,
  "effect": { "attack": 12, "range": 3.25, "cooldown": 0.75 }
}
