{
  "formatVersion": 1,
  "id": "developer.civic-pulse-emitter",
  "name": "Civic Pulse Emitter",
  "description": "A short-range directed tool for safely disabling hostile cybernetic implants without lasting harm.",
  "license": "CC0-1.0",
  "type": "tool",
  "action": "disable-pulse",
  "charges": 24,
  "effect": {
    "attack": 12,
    "range": 13,
    "cooldown": 0.75
  },
  "price": 15,
  "icon": "pulse"
}
